{
  "사업명": "OO 종합솔루션 지원사업(통합형 OO화)",
  "과제명": "예시 과제명 — 중소제조기업형 클라우드 통합관리 SaaS 플랫폼",
  "사업개요": "과제내용에 대하여 간단히 요약 기술 (예시 텍스트)",
  "개발솔루션": [
    "예시 솔루션 A",
    "예시 솔루션 B",
    "예시 솔루션 C",
    "예시 솔루션 D",
    "예시 솔루션 E"
  ],
  "수행기간": {
    "개발시작": "'26.6.30",
    "개발종료": "'27.6.30",
    "개발기간": "12개월",
    "실증시작": "'27.6.30",
    "실증종료": "'27.12.31",
    "실증기간": "6개월"
  },
  "대표공급기업": {
    "기업명": "(주)예시소프트",
    "사업자등록번호": "000-00-00000",
    "대표자명": "홍길동",
    "법인등록번호": "000000-0000000",
    "본사정보": "서울특별시 OO구 OO로 000",
    "지역": "서울",
    "주요솔루션": "예시 솔루션 A\n예시 솔루션 B\n예시 솔루션 C",
    "담당자": {
      "성명": "김OO",
      "부서": "기술개발팀",
      "직위": "팀장",
      "전화": "02-0000-0000",
      "휴대전화": "010-0000-0000",
      "E-mail": "example@example.co.kr"
    }
  },
  "클라우드사업자": {
    "기업명": "(주)예시클라우드",
    "사업자등록번호": "000-00-00000",
    "대표자명": "이OO",
    "법인등록번호": "000000-0000000",
    "본사정보": "서울특별시 OO구 OO대로 000",
    "지역": "서울",
    "주요솔루션": "",
    "담당자": {
      "성명": "박OO",
      "부서": "클라우드사업부",
      "직위": "과장",
      "전화": "02-0000-0000",
      "휴대전화": "010-0000-0000",
      "E-mail": "cloud@example.co.kr"
    }
  },
  "협력기관": {
    "기업명": "OO연구원",
    "사업자등록번호": "000-00-00000",
    "대표자명": "최OO",
    "법인등록번호": "000000-0000000",
    "본사정보": "대전광역시 OO구 OO로 000",
    "지역": "대전",
    "주요솔루션": "",
    "담당자": {
      "성명": "정OO",
      "부서": "연구개발부",
      "직위": "선임연구원",
      "전화": "042-0000-0000",
      "휴대전화": "010-0000-0000",
      "E-mail": "research@example.re.kr"
    }
  },
  "참여공급기업": [
    { "번호": "1", "기업명": "(주)예시기업A", "대표자명": "강OO", "전화": "02-0000-0000", "휴대전화": "010-0000-0000", "E-mail": "a@example.co.kr", "지역": "경기" },
    { "번호": "2", "기업명": "(주)예시기업B", "대표자명": "윤OO", "전화": "031-0000-0000", "휴대전화": "010-0000-0000", "E-mail": "b@example.co.kr", "지역": "경기" },
    { "번호": "3", "기업명": "(주)예시기업C", "대표자명": "한OO", "전화": "032-0000-0000", "휴대전화": "010-0000-0000", "E-mail": "c@example.co.kr", "지역": "인천" }
  ],
  "도입실증기업": [
    { "번호": "1", "기업명": "(주)실증기업A", "대표자명": "오OO", "전화": "053-0000-0000", "휴대전화": "010-0000-0000", "E-mail": "d@example.co.kr", "지역": "대구" },
    { "번호": "2", "기업명": "(주)실증기업B", "대표자명": "서OO", "전화": "055-0000-0000", "휴대전화": "010-0000-0000", "E-mail": "e@example.co.kr", "지역": "경남" },
    { "번호": "3", "기업명": "(주)실증기업C", "대표자명": "남OO", "전화": "052-0000-0000", "휴대전화": "010-0000-0000", "E-mail": "f@example.co.kr", "지역": "울산" },
    { "번호": "4", "기업명": "(주)실증기업D", "대표자명": "임OO", "전화": "041-0000-0000", "휴대전화": "010-0000-0000", "E-mail": "g@example.co.kr", "지역": "충남" },
    { "번호": "5", "기업명": "(주)실증기업E", "대표자명": "조OO", "전화": "054-0000-0000", "휴대전화": "010-0000-0000", "E-mail": "h@example.co.kr", "지역": "경북" }
  ],
  "개발개요": {
    "어플리케이션명칭": "예시 — OO 통합관리 클라우드 SaaS 플랫폼",
    "어플리케이션소개": "예시 소개 텍스트. 기존에 독립적으로 운영되던 시스템들을 단일 클라우드 플랫폼으로 통합하여 업무 연속성을 보장함.",
    "활용가능업종": "예시 업종 (제조업 등)",
    "활용가능공정": "예시 공정 (생산, 품질관리 등)",
    "활용가능생산품목": "예시 품목 (범용 제조 설비)",
    "활용기대효과": "예시 효과 (생산성 향상, 비용 절감 등)"
  },
  "KPI": [
    { "지표명": "(예시) 시간당 생산량", "분야": "P", "단위": "개/h", "현재수준": "00", "목표수준": "00", "가중치": "0.0", "비고": "예시 공정" },
    { "지표명": "(예시) 공정 불량률", "분야": "Q", "단위": "%", "현재수준": "00", "목표수준": "00", "가중치": "0.0", "비고": "예시 공정" },
    { "지표명": "(예시) 재공재고", "분야": "C", "단위": "백만원", "현재수준": "00", "목표수준": "00", "가중치": "0.0", "비고": "예시" },
    { "지표명": "(예시) 리드타임", "분야": "D", "단위": "일", "현재수준": "00", "목표수준": "00", "가중치": "0.0", "비고": "예시" }
  ],
  "산출물목록": [
    { "단계": "분석단계", "산출물": "현행업무 분석서", "작성내용": "업종의 업무 흐름, 세부 업무 절차 흐름도 등" },
    { "단계": "", "산출물": "요구사항 정의서", "작성내용": "요구사항 세부요건, 제약사항 등을 정의" },
    { "단계": "설계단계", "산출물": "아키텍처 설계서", "작성내용": "시스템 구성, 장비 도입 및 설치 계획" },
    { "단계": "", "산출물": "화면설계서", "작성내용": "화면표준, 메뉴구조, 각 화면별 구성 항목" },
    { "단계": "", "산출물": "프로그램 설계서", "작성내용": "프로그램 목록 및 기능 단위 세부구성" },
    { "단계": "", "산출물": "DB 설계서", "작성내용": "테이블 목록 및 세부 구성" },
    { "단계": "시험단계", "산출물": "단위테스트 결과서", "작성내용": "기능 단위 테스트 시나리오 및 수행 결과" },
    { "단계": "", "산출물": "통합테스트 결과서", "작성내용": "업무 프로세스 단위 테스트 수행 결과" },
    { "단계": "", "산출물": "솔루션 출시 결과서", "작성내용": "시스템 출시 검증 결과" },
    { "단계": "", "산출물": "매뉴얼", "작성내용": "사용자, 관리자별 업무 참조 매뉴얼" },
    { "단계": "", "산출물": "사용자테스트 결과서", "작성내용": "운영환경 테스트 결과 및 결함내역" },
    { "단계": "실증", "산출물": "실증결과 보고서", "작성내용": "로그기록, 사용자수, 장애 관리 내역 등" }
  ],
  "사업비": {
    "총사업비": 0,
    "정부지원금": 0,
    "컨소시엄부담금": {
      "대표공급기업": null,
      "참여공급기업": null,
      "클라우드사업자": null,
      "소계": null
    },
    "현물": null
  },
  "참여인력": {
    "총괄책임자": {
      "성명": "",
      "소속기관": "",
      "직위": "",
      "담당업무": "총괄PM",
      "참여율": "",
      "학력": "",
      "경력": ""
    },
    "주요참여인력": []
  },
  "서명문구": "상기 기업은 위의 내용과 같이 OO 지원사업을 신청합니다.\n2026년  월    일\n대표공급기업명 :\n대표공급기업 대표자(또는 사업담당자) :              (직인)\nOO추진단장 귀하"
}
